{
  "schema_version": 1,
  "pipeline_version": "v6",
  "run_id": "data-analysis-2025-11-27-20251127030303.-38a0dff6",
  "date": "2025-11-27",
  "source": "huggingface",
  "generated_at": "2025-11-27T03:03:03.961Z",
  "items": [
    {
      "canonical_id": "huggingface:sentence-transformers/all-MiniLM-L6-v2",
      "promptHash": "sha256:8ca19d098c0d5ea46046da1c9f3b1a75106bb839b2c9e9dd8eef54e1c97f811a",
      "summary_version": 0,
      "status": "passonce",
      "name": "all-MiniLM-L6-v2",
      "url": "https://huggingface.co/sentence-transformers/all-MiniLM-L6-v2",
      "tags": [
        "sentence-transformers",
        "pytorch",
        "tf",
        "rust",
        "onnx",
        "safetensors",
        "openvino",
        "bert",
        "feature-extraction",
        "sentence-similarity",
        "transformers",
        "en",
        "dataset:s2orc",
        "dataset:flax-sentence-embeddings/stackexchange_xml",
        "dataset:ms_marco",
        "dataset:gooaq",
        "dataset:yahoo_answers_topics",
        "dataset:code_search_net",
        "dataset:search_qa",
        "dataset:eli5",
        "dataset:snli",
        "dataset:multi_nli",
        "dataset:wikihow",
        "dataset:natural_questions",
        "dataset:trivia_qa",
        "dataset:embedding-data/sentence-compression",
        "dataset:embedding-data/flickr30k-captions",
        "dataset:embedding-data/altlex",
        "dataset:embedding-data/simple-wiki",
        "dataset:embedding-data/QQP",
        "dataset:embedding-data/SPECTER",
        "dataset:embedding-data/PAQ_pairs",
        "dataset:embedding-data/WikiAnswers",
        "arxiv:1904.06472",
        "arxiv:2102.07033",
        "arxiv:2104.08727",
        "arxiv:1704.05179",
        "arxiv:1810.09305",
        "license:apache-2.0",
        "autotrain_compatible",
        "text-embeddings-inference",
        "endpoints_compatible",
        "deploy:azure",
        "region:us"
      ],
      "summary_short": {
        "zh": "",
        "en": "",
        "es": ""
      },
      "summary_flags": {
        "needs_tri": true,
        "fast_first": true,
        "placeholder": true
      },
      "stats": {
        "downloads_total": 147886651,
        "likes_total": 4159
      },
      "metadata": {
        "license": "N/A",
        "lang": "N/A",
        "categories": {
          "capabilities": [],
          "scenes": [],
          "lifecycle": []
        }
      },
      "created_at": "2025-11-27T02:59:31.432Z",
      "updated_at": "2025-11-27T02:59:31.432Z",
      "source": "huggingface",
      "locale_pref": [
        "zh",
        "en"
      ]
    },
    {
      "canonical_id": "huggingface:google/electra-base-discriminator",
      "promptHash": "sha256:b7a35829f521c4fdcddf87805ac9f16ebd258cc548173cdfb983730156ddf6b9",
      "summary_version": 0,
      "status": "passonce",
      "name": "electra-base-discriminator",
      "url": "https://huggingface.co/google/electra-base-discriminator",
      "tags": [
        "transformers",
        "pytorch",
        "tf",
        "jax",
        "rust",
        "electra",
        "pretraining",
        "en",
        "arxiv:1406.2661",
        "license:apache-2.0",
        "endpoints_compatible",
        "region:us"
      ],
      "summary_short": {
        "zh": "",
        "en": "",
        "es": ""
      },
      "summary_flags": {
        "needs_tri": true,
        "fast_first": true,
        "placeholder": true
      },
      "stats": {
        "downloads_total": 74266286,
        "likes_total": 69
      },
      "metadata": {
        "license": "N/A",
        "lang": "N/A",
        "categories": {
          "capabilities": [],
          "scenes": [],
          "lifecycle": []
        }
      },
      "created_at": "2025-11-27T02:59:31.432Z",
      "updated_at": "2025-11-27T02:59:31.432Z",
      "source": "huggingface",
      "locale_pref": [
        "zh",
        "en"
      ]
    },
    {
      "canonical_id": "huggingface:Falconsai/nsfw_image_detection",
      "promptHash": "sha256:d68f22b78f483c3f4da589cd97abc6ccedca740c144f8eea8eea06dbc1b3527d",
      "summary_version": 0,
      "status": "passonce",
      "name": "nsfw_image_detection",
      "url": "https://huggingface.co/Falconsai/nsfw_image_detection",
      "tags": [
        "transformers",
        "pytorch",
        "safetensors",
        "vit",
        "image-classification",
        "arxiv:2010.11929",
        "license:apache-2.0",
        "autotrain_compatible",
        "endpoints_compatible",
        "region:us"
      ],
      "summary_short": {
        "zh": "",
        "en": "",
        "es": ""
      },
      "summary_flags": {
        "needs_tri": true,
        "fast_first": true,
        "placeholder": true
      },
      "stats": {
        "downloads_total": 68858206,
        "likes_total": 899
      },
      "metadata": {
        "license": "N/A",
        "lang": "N/A",
        "categories": {
          "capabilities": [],
          "scenes": [],
          "lifecycle": []
        }
      },
      "created_at": "2025-11-27T02:59:31.432Z",
      "updated_at": "2025-11-27T02:59:31.432Z",
      "source": "huggingface",
      "locale_pref": [
        "zh",
        "en"
      ]
    },
    {
      "canonical_id": "huggingface:google-bert/bert-base-uncased",
      "promptHash": "sha256:103bf1cded07197c1a0c664f6dcb115c0d0822e3d00b7dfad50034a8b7a28f29",
      "summary_version": 0,
      "status": "passonce",
      "name": "bert-base-uncased",
      "url": "https://huggingface.co/google-bert/bert-base-uncased",
      "tags": [
        "transformers",
        "pytorch",
        "tf",
        "jax",
        "rust",
        "coreml",
        "onnx",
        "safetensors",
        "bert",
        "fill-mask",
        "exbert",
        "en",
        "dataset:bookcorpus",
        "dataset:wikipedia",
        "arxiv:1810.04805",
        "license:apache-2.0",
        "autotrain_compatible",
        "endpoints_compatible",
        "region:us",
        "deploy:azure"
      ],
      "summary_short": {
        "zh": "",
        "en": "",
        "es": ""
      },
      "summary_flags": {
        "needs_tri": true,
        "fast_first": true,
        "placeholder": true
      },
      "stats": {
        "downloads_total": 61035381,
        "likes_total": 2488
      },
      "metadata": {
        "license": "N/A",
        "lang": "N/A",
        "categories": {
          "capabilities": [],
          "scenes": [],
          "lifecycle": []
        }
      },
      "created_at": "2025-11-27T02:59:31.432Z",
      "updated_at": "2025-11-27T02:59:31.432Z",
      "source": "huggingface",
      "locale_pref": [
        "zh",
        "en"
      ]
    },
    {
      "canonical_id": "huggingface:dima806/fairface_age_image_detection",
      "promptHash": "sha256:d4ebed2fed33cd009380729ce8833b808d63b9f427e856535d0929ba5f9896f4",
      "summary_version": 0,
      "status": "passonce",
      "name": "fairface_age_image_detection",
      "url": "https://huggingface.co/dima806/fairface_age_image_detection",
      "tags": [
        "transformers",
        "safetensors",
        "vit",
        "image-classification",
        "dataset:nateraw/fairface",
        "base_model:google/vit-base-patch16-224-in21k",
        "base_model:finetune:google/vit-base-patch16-224-in21k",
        "license:apache-2.0",
        "autotrain_compatible",
        "endpoints_compatible",
        "region:us"
      ],
      "summary_short": {
        "zh": "",
        "en": "",
        "es": ""
      },
      "summary_flags": {
        "needs_tri": true,
        "fast_first": true,
        "placeholder": true
      },
      "stats": {
        "downloads_total": 25356871,
        "likes_total": 53
      },
      "metadata": {
        "license": "N/A",
        "lang": "N/A",
        "categories": {
          "capabilities": [],
          "scenes": [],
          "lifecycle": []
        }
      },
      "created_at": "2025-11-27T02:59:31.432Z",
      "updated_at": "2025-11-27T02:59:31.432Z",
      "source": "huggingface",
      "locale_pref": [
        "zh",
        "en"
      ]
    }
  ],
  "stats": {
    "total": 5,
    "from_fast_first": 5,
    "from_cache": 0
  }
}
