{
  "schema_version": 1,
  "pipeline_version": "v6",
  "run_id": "data-analysis-2026-01-31-20260131032628.-9843c4b2",
  "date": "2026-01-31",
  "source": "github",
  "generated_at": "2026-01-31T03:26:28.925Z",
  "items": [],
  "stats": {
    "total": 0,
    "from_fast_first": 0,
    "from_cache": 0
  }
}
