{
  "schema_version": 1,
  "pipeline_version": "v6",
  "run_id": "data-analysis-2025-11-05-20251105030142.-2ec4c6b6",
  "date": "2025-11-05",
  "source": "huggingface",
  "generated_at": "2025-11-05T03:01:42.041Z",
  "items": [],
  "stats": {
    "total": 0,
    "from_fast_first": 0,
    "from_cache": 0
  }
}
