{
  "schema_version": 1,
  "pipeline_version": "v6",
  "run_id": "data-analysis-2025-10-14-20251014025238.-857f7647",
  "date": "2025-10-14",
  "source": "huggingface",
  "generated_at": "2025-10-14T02:52:38.212Z",
  "items": [
    {
      "canonical_id": "huggingface:kyutai/moshiko-pytorch-bf16",
      "promptHash": "sha256:e3589fd173878ba41d7d42db53a7e34f9262fb3f2736568619628dfe23738769",
      "summary_version": 0,
      "status": "passonce",
      "name": "moshiko-pytorch-bf16",
      "url": "https://huggingface.co/kyutai/moshiko-pytorch-bf16",
      "tags": [
        "moshi",
        "safetensors",
        "en",
        "license:cc-by-4.0",
        "region:us"
      ],
      "summary_short": {
        "zh": "",
        "en": "",
        "es": ""
      },
      "summary_flags": {
        "needs_tri": true,
        "fast_first": true,
        "placeholder": true
      },
      "stats": {
        "downloads_total": 2898579,
        "likes_total": 186
      },
      "metadata": {
        "license": "N/A",
        "lang": "N/A",
        "categories": {
          "capabilities": [],
          "scenes": [],
          "lifecycle": []
        }
      },
      "created_at": "2025-10-14T02:51:23.039Z",
      "updated_at": "2025-10-14T02:51:23.039Z",
      "source": "huggingface",
      "locale_pref": [
        "zh",
        "en"
      ]
    },
    {
      "canonical_id": "huggingface:Qwen/Qwen2-VL-7B-Instruct",
      "promptHash": "sha256:67106fd1cc2adc139bf3058988983aff541c2645eb0629ea5b5199d007b66ea6",
      "summary_version": 0,
      "status": "passonce",
      "name": "Qwen2-VL-7B-Instruct",
      "url": "https://huggingface.co/Qwen/Qwen2-VL-7B-Instruct",
      "tags": [
        "transformers",
        "safetensors",
        "qwen2_vl",
        "image-to-text",
        "multimodal",
        "image-text-to-text",
        "conversational",
        "en",
        "arxiv:2409.12191",
        "arxiv:2308.12966",
        "base_model:Qwen/Qwen2-VL-7B",
        "base_model:finetune:Qwen/Qwen2-VL-7B",
        "license:apache-2.0",
        "text-generation-inference",
        "endpoints_compatible",
        "region:us"
      ],
      "summary_short": {
        "zh": "",
        "en": "",
        "es": ""
      },
      "summary_flags": {
        "needs_tri": true,
        "fast_first": true,
        "placeholder": true
      },
      "stats": {
        "downloads_total": 1877266,
        "likes_total": 1231
      },
      "metadata": {
        "license": "N/A",
        "lang": "N/A",
        "categories": {
          "capabilities": [],
          "scenes": [],
          "lifecycle": []
        }
      },
      "created_at": "2025-10-14T02:51:23.039Z",
      "updated_at": "2025-10-14T02:51:23.039Z",
      "source": "huggingface",
      "locale_pref": [
        "zh",
        "en"
      ]
    },
    {
      "canonical_id": "huggingface:Salesforce/blip-image-captioning-base",
      "promptHash": "sha256:41691c166cdc559b316d85015f6aff9ab1bddda9de8f5914942dbafcbf5f6bff",
      "summary_version": 0,
      "status": "passonce",
      "name": "blip-image-captioning-base",
      "url": "https://huggingface.co/Salesforce/blip-image-captioning-base",
      "tags": [
        "transformers",
        "pytorch",
        "tf",
        "blip",
        "image-to-text",
        "image-captioning",
        "arxiv:2201.12086",
        "license:bsd-3-clause",
        "endpoints_compatible",
        "region:us"
      ],
      "summary_short": {
        "zh": "",
        "en": "",
        "es": ""
      },
      "summary_flags": {
        "needs_tri": true,
        "fast_first": true,
        "placeholder": true
      },
      "stats": {
        "downloads_total": 1875520,
        "likes_total": 791
      },
      "metadata": {
        "license": "N/A",
        "lang": "N/A",
        "categories": {
          "capabilities": [],
          "scenes": [],
          "lifecycle": []
        }
      },
      "created_at": "2025-10-14T02:51:23.039Z",
      "updated_at": "2025-10-14T02:51:23.039Z",
      "source": "huggingface",
      "locale_pref": [
        "zh",
        "en"
      ]
    }
  ],
  "stats": {
    "total": 3,
    "from_fast_first": 3,
    "from_cache": 0
  }
}
